사고 번호,사고 장소,사고 장소 특징,A 진행 방향,B 진행 방향,과실 비율 A,과실 비율 B,사고 유형,차번호/사고유형,관련법규,판례·조정사례
차대차,직선 도로,추돌 사고,선행 자동차(1차 사고자)를 추돌,선행 자동차(1차 사고자),80,20,0,같은 방향 진행차량 상호 간의 사고 > 주정차 차량 추돌사고 > 차로 주·정차 중 재추돌(2차) 사고(고속도로등 포함) > 차42-1,"◆도로교통법 제19조(안전거리 확보 등) 
① 모든 차의 운전자는 같은 방향으로 가고 있는 앞차의 뒤를 따르는 경우에는 앞차가 갑자기 정지하게 되는 경우 그 앞차와의 충돌을 피할 수 있는 필요한 거리를 확보하여야 한다.
◆도로교통법 제48조(안전운전 및 친환경 경제운전의 의무) 
① 모든 차 또는 노면전차의 운전자는 차 또는 노면전차의 조향장치와 제동장치, 그 밖의 장치를 정확하게 조작하여야 하며, 도로의 교통상황과 차 또는 노면전차의 구조 및 성능에 따라 다른 사람에게 위험과 장해를 주는 속도나 방법으로 운전하여서는 아니 된다.
◆도로교통법 제64조 (고속도로등에서의 정차 및 주차의 금지) 자동차의 운전자는 고속도로등에서 차를 정차하거나 주차시켜서는 아니 된다. 다만, 다음 각 호의 어느 하나에 해당하는 경우에는 그러하지 아니하다.
1. 법령의 규정 또는 경찰공무원(자치경찰공무원은 제외한다)의 지시에 따르거나 위험을 방지하기 위하여 일시 정차 또는 주차시키는 경우
②. 정차 또는 주차할 수 있도록 안전표지를 설치한 곳이나 정류장에서 정차 또는 주차시키는 경우
③. 고장이나 그 밖의 부득이한 사유로 길가장자리구역(갓길을 포함한다)에 정차 또는 주차시키는 경우
④. 통행료를 내기 위하여 통행료를 받는 곳에서 정차하는 경우 5. 도로의 관리자가 고속도로등을 보수·유지 또는 순회하기 위하여 정차 또는 주차시키는 경우
⑥. 경찰용 긴급자동차가 고속도로등에서 범죄수사, 교통단속이나 그 밖의 경찰임무를 수행하기 위하여 정차 또는 주차시키는 경우
⑥의
②. 소방차가 고속도로등에서 화재진압 및 인명 구조·구급 등 소방활동, 소방지원활동 및 생활안전활동을 수행하기 위하여 정차 또는 주차시키는 경우
⑥의
③. 경찰용 긴급자동차 및 소방차를 제외한 긴급자동차가 사용 목적을 달성하기 위하여 정차 또는 주차시키는 경우
7. 교통이 밀리거나 그 밖의 부득이한 사유로 움직일 수 없을 때에 고속도로등의 차로에 일시정차 또는 주차시키는 경우
◆도로교통법 제66조(고장 등의 조치) 
자동차의 운전자는 고장이나 그 밖의 사유로 고속도로등에서 자동차를 운행할 수 없게 되었을 때에는 행정안전부령으로 정하는 표지(이하 고장자동차의 표지라 한다)를 설치하여야 하며, 그 자동차를 고속도로등이 아닌 다른 곳으로 옮겨 놓는 등의 필요한 조치를 하여야 한다.","◆대법원 2014. 3. 27. 선고 2013다215904 판결 
고속도로나 자동차전용도로에서 선행사고로 자동차를 운행할 수 없게 되었음에도 자동차를 안전한 장소로 이동시키거나 관계 법령이 정한 고장자동차의 표지를 설치하는 등의 안전조치를 취하지 아니한 채 주행차로에 정지해 있는 사이에 뒤따라온 후행차량에 의한 추돌사고가 발생한 경우, 선행차량 운전자에게 선행사고의 발생에 아무런 과실이 없고, 사고 후 안전조치 등을 취할 시간적 여유가 없거나 부상 등으로 그러한 조치를 기대하기 어려운 상황에 처해 있다가 후행사고를 당한 때에는 후행사고로 인한 손해배상액을 산정함에 있어 선행차량 B의 과실을 참작할 여지가 없다.
◆대법원 2019. 6. 27. 선고 2018다226015판결 
고속도로에서 선행차량이 사고 등의 사유로 안전조치를 취하지 아니한 채 주행차로에 정지해있는 사이에 뒤따라온 자동차에 의하여 추돌사고가 발생한 경우에, 안전조치를 취하지 아니한 정차로 인하여 후행차량이 선행차량을 충돌하고 나아가 그 주변의 다른 차량이나 사람들을 충돌할 수도 있다는 것을 충분히 예상할 수 있으므로, 선행차량 운전자가 정지 후 안전조치를 취할 수 있었음에도 과실로 이를 게을리하였거나, 또는 정지 후 시간적 여유 부족이나 부상 등의 사유로 안전조치를 취할 수 없었다고 하더라도 그 정지가 선행차량 운전자의 과실로 발생된 선행사고로 인한 경우 등과 같이 그의 과실에 의하여 비롯된 것이라면, 안전조치 미이행 또는 선행사고의 발생 등으로 인한 정지와 후행 추돌사고 및 그로 인하여 연쇄적으로 발생된 사 고들 사이에는 특별한 사정이 없는 한 인과관계가 있고, 손해의 공평한 분담이라는 손해배상제도의 이념에 비추어 볼 때에 선행차량 운전자의 과실은 후행사고들로 인한 손해배상책임에 관한 분담범위를 정할 때에 참작되어야 한다."
,직선 도로,추돌 사고,후행 추돌,선행 직진,100,0,1,같은 방향 진행차량 상호 간의 사고 > 안전거리미확보로 인한 추돌사고 > 양 차량 주행 중 후방 추돌(앞차량 정지 직후 포함) > 차41-1,"◆도로교통법 제17조(자동차등과 노면전차의 속도) 
① 자동차등(개인형 이동장치는 제외한다. 이하 이 조에서 같다)과 노면전차의 도로 통행 속도는 행정안전부령으로 정한다.
② 경찰청장이나 시·도경찰청장은 도로에서 일어나는 위험을 방지하고 교통의 안전과 원활한 소통을 확보하기 위하여 필요하다고 인정하는 경우에는 다음 각 호의 구분에 따라 구역이나 구간을 지정하여 제1항에 따라 정한 속도를 제한할 수 있다.
1. 경찰청장: 고속도로
②. 시·도경찰청장: 고속도로를 제외한 도로
③ 자동차등과 노면전차의 운전자는 제1항과 제2항에 따른 최고속도보다 빠르게 운전하거나 최저속도보다 느리게 운전하여서는 아니 된다. 다만, 교통이 밀리거나 그 밖의 부득이한 사유로 최저속도보다 느리게 운전할 수밖에 없는 경우에는 그러하지 아니하다.
◆도로교통법 제19조(안전거리확보 등) 
① 모든 차의 운전자는 같은 방향으로 가고 있는 앞차의 뒤를 따르는 경우에는 앞차가 갑자기 정지하게 되는 경우 그 앞차와의 충돌을 피할 수 있는 필요한 거리를 확보하여야 한다.
④ 모든 차의 운전자는 위험방지를 위한 경우와 그 밖의 부득이한 경우가 아니면 운전하는 차를 갑자기 정지시키거나 속도를 줄이는 등의 급제동을 하여서는 아니 된다.","◆대법원 1997. 11. 25. 선고 97다41639 판결 
도로교통법 제17조 제1항(현행 제19조 1항)은 “모든 차는 같은 방향으로 가고 있는 앞차의뒤를 따르는 때에는 앞차가 갑자기 정지하게 되는 경우에 그 앞차와의 충돌을 피할 만한 필요한 거리를 확보하여야 한다.”고 규정 하고 있는바, 이는 앞차가 제동기의 제동력에 의하여 정지한 경우뿐만 아니라, 제동기 이외의 작용에 의하여 갑자기 정지한 경우도 포함한다.
◆울산지방법원 2013.8.30. 선고 2011가단34087, 41405 판결 
주간에 왕복1차로의 도로에서 A차량이 직진하던 중 전방주시를 태만히 하고 안전거리를 충분히 확보하지 아니한 과실로, 전방에서 같은 방향으로 진행하던 B차량이 정차하는 것을 뒤늦게 발견하고 제동장치를 제때 조작하지 못함으로써 B차량의 뒷부분을 추돌하여 상해를 입힌 사고 : B과실 0%.
◆서울고등법원 2009.10.23. 선고 2008나110137 판결 - (서울중앙지방법원 2007가단371467 판결) 
주간에 편도4차로의 도로에서 A차량이 0.141%의 술에 취한 상태로 1차로를 진행하던 중, 같은 차로에서 앞서 진행하던 B차량을 추돌하여 B차량으로 하여금 신호대기를 위하여 정차 중이던 C차량을 충돌케 한 사고 : B과실 0%
◆서울동부지방법원 2007. 1. 26. 선고 2005가단49363 판결 주간에 고속도로에서 B차량이 선행하던 중, 마침 뒤에서 전방주시의무를 태만한 채 운행 중인 A차량에 추돌당한 사안: B과실 0%
◆서울중앙지방법원 2018. 9. 5. 선고 2018나16484 판결 
새벽에 B차량(화물트럭)이 타이어 펑크로 갓길을 따라 최저속도(시속 50km)보다 다소 낮은 시속 40km로 주행 중이고 야간등 켜고 있었고 야간이지만 가로등이 켜져 있었는데, A차량이 추돌시까지 스키드마크가 전혀 없어 졸음운전이 추정되어 전방주시의무를 현저하게 태만히 한 것으로 보이므로 B차량의 저속 주행과 사고 발생 사이에 별다른 영향이 없다고 보아 A차량 100%. (고속도로 사고)
◆서울남부지방법원 2021. 6. 25. 선고 2020나71619판결 
주간에, A이륜차가 앞서가던 B차량이 감속하자 피하면서 충돌한 사고에서, B차량이 전방에 횡단보도 및 과속단속카메라가 설치되어 있는 것을 발견하고 감속하며 주행 중이었고 감속 정도가 통상적인 운행 중 사고를 유발시킬 만한 급제동에 해당한다고 보기 부족하고 설령 속도 줄인 것이 다소 갑작스럽다고 하더라도 부득이 전방 횡단보도 상 보행자 동태를 파악하기 위한 조치이므로, 시야 확보에 전혀 지장이 없는 상황에서 전방주시의무와 안전거리미확보를 태만히 한 A차량 과실 100%.(이륜차 사고)"
,직선 도로,추돌 사고,주정차,후행 추돌,0,100,2,같은 방향 진행차량 상호 간의 사고 > 주정차 차량 추돌사고 > 일반 도로 가장자리(갓길포함) 주·정차 > 차42-2,"◆도로교통법 제32조(정차 또는 주차의 금지) 
모든 차의 운전자는 다음 각 호의 어느 하나에 해당하는 곳에서는 차를 정차하거나 주차하여서는 아니 된다. 다만, 이 법이나 이 법에 따른 명령 또는 경찰공무원의 지시를 따르는 경우와 위험방지를 위하여 일시정지하는 경우에는 그러하지 아니하다.
1. 교차로·횡단보도·건널목이나 보도와 차도가 구분된 도로의 보도(「주차장법에 따라 차도와 보도에 걸쳐서 설치된 노상주차장은 제외한다)
②. 교차로의 가장자리나 도로의 모퉁이로부터 5미터 이내인 곳
③. 안전지대가 설치된 도로에서는 그 안전지대의 사방으로부터 각각 10미터 이내인 곳
④. 버스여객자동차의 정류지(停留地)임을 표시하는 기둥이나 표지판 또는 선이 설치된 곳으로부터 10미터 이내인 곳. 다만, 버스여객자동차의 운전자가 그 버스여객자동차의 운행시간 중에 운행노선에 따르는 정류장에서 승객을 태우거나 내리기 위하여 차를 정차하거나 주차하는 경우에는 그러하지 아니하다.
⑤. 건널목의 가장자리 또는 횡단보도로부터 10미터 이내인 곳
⑥. 다음 각 목의 곳으로부터 5미터 이내인 곳
가. 「소방기본법」 제10조에 따른 소방용수시설 또는 비상소화장치가 설치된 곳
나. 「화재예방, 소방시설 설치·유지 및 안전관리에 관한 법률」 제2조 제1항 제1호에 따른 소방시설로서 대통령령으로 정하는 시설이 설치된 곳
7. 시·도경찰청장이 도로에서의 위험을 방지하고 교통의 안전과 원활한 소통을 확보하기 위하여 필요하다고 인정하여 지정한 곳
◆도로교통법 제33조(주차금지의 장소) 
모든 차의 운전자는 다음 각 호의 어느 하나에 해당하는 곳에 차를 주차해서는 아니 된다.
1. 터널 안 및 다리 위
②. 다음 각 목의 곳으로부터 5미터 이내인 곳
가. 도로공사를 하고 있는 경우에는 그 공사 구역의 양쪽 가장자리
나. 「다중이용업소의 안전관리에 관한 특별법」에 따른 다중이용업소의 영업장이 속한 건축물로 소방본부장의 요청에 의하여 시·도경찰청장이 지정한 곳
③. 시·도경찰청장 이 도로에서의 위험을 방지하고 교통의 안전과 원활한 소통을 확보하기 위하여 필요하다고 인정하여 지정한 곳
◆도로교통법 제34조(정차 또는 주차의 방법 및 시간의 제한) 
도로 또는 노상주차장에 정차하거나 주차하려고 하는 차의 운전자는 차를 차도의 우측 가장자리에 정차하는 등 대통령령으로 정하는 정차 또는 주차의 방법·시간과 금지사항 등을 지켜야 한다.","◆대법원 1996. 2. 9. 선고 95다39359판결 
운전자의 후방조치의무는 고속도로 또는 자동차전용도로에서의 정차나 차량의 통행이 잦아 정차 사실을 후행 차량에게 사전에 쉽게 알릴 수 없는 경우에 필요한 것이고, 그렇지 않고 속도가 제한되어 있고 후행 차량에게 쉽게 정차 사실을 알릴 수 있는 곳이라면(일반도로) 굳이 운전자에게 이러한 안전의무 조치를 요구할 수는 없다. (운전자 후방조치의무)
◆서울중앙지방법원 2019.04.17.선고 2018나62265 판결 
주간에, A차량이 매장 앞에서 물건을 하차하기 위해 삼거리(T자) 교차로의 모서리 부근에 있는 횡단보도를 걸쳐 주·정차 중이었는데, B차량이 후진하면서 A차량을 충격한 사고에서, 도로교통법 제32조에 따라 삼거리(T자) 교차로의 모서리 부근에 있는 횡단보도를 걸친 불법 주· 정차 과실 역시 사고 발생 및 손해 확대의 원인이 되었으므로 A 과실 20%.(불법 주정차)
◆서울중앙지방법원 2019. 08. 21.선고 2019나23090 판결 
새벽에, B차량이 편도 2차로 도로 중 2차로에 주차되어 있는 A차량을 충격한 사고에서, 황색 실선 및 주정차금지표지판이 설치된 주차금지구역임에도 2차로 도로의 한 개 차로를 A대형 버스로 점유하여 불법 주차를 하였을 뿐 아니라 후행 차량 운전자들이 추돌하지 않도록 비상등, 전조등 및 차폭등 점등 등 안전조치를 취하지도 않은 점 등 A차량의 불법주차가 사고의 발 생 및 확대에 영향을 미쳤으므로 A과실 20%.(불법 주정차)"
,직선 도로,차로 감소 도로 (합류),본선에서 직진,차로 감소 도로에서 본선으로 합류,40,60,3,같은 방향 진행차량 상호 간의 사고 > 진로변경 사고 > 차로 감소 도로 (합류) 사고 > 차43-1,"◆도로교통법 제19조(안전거리 확보 등) 
③ 모든 차의 운전자는 차의 진로를 변경하려는 경우에 그 변경하려는 방향으로 오고 있는 다른 차의 정상적인 통행에 장애를 줄 우려가 있을 때에는 진로를 변경하여서는 아니 된다.
◆도로교통법 제38조(차의 신호) 
① 모든 차의 운전자는 좌회전·우회전·횡단·유턴·서행·정지 또는 후진을 하거나 같은 방향으로 진행하면서 진로를 바꾸려고 하는 경우와 회전교차로에 진입하거나 회전교차로에서 진출하는 경우에는 손이나 방향지시기 또는 등화로써 그 행위가 끝날 때까지 신호를 하여야 한다.
② 제1항의 신호를 하는 시기와 방법은 대통령령으로 정한다.
◆도로교통법 제48조(안전운전 및 친환경 경제운전의 의무) 
① 모든 차 또는 노면전차의 운전자는 차 또는 노면전차의 조향장치와 제동장치, 그 밖의 장치를 정확하게 조작하여야 하며, 도로의 교통상황과 차 또는 노면전차의 구조 및 성능에 따라 다른 사람에게 위험과 장해를 주는 속도나 방법으로 운전하여서는 아니 된다.","◆대법원 1994. 4. 29. 선고 94다4707 판결 (서울고등법원 93나27880 판결, 서울 민사지법 93가합3597 판결) 
주간에 고속도로 차로감소지점(편도3차로→편도2차로)에서 B차량이 3차로(감소되는 차로)에서 본선 2차로로 진로를 변경하던 중 전방좌우주시의무를 태만히 한 채 2차로에서 앞서 진행하던 A차량을 추월하여 무리하게 그 앞으로 진입하려 한 과실로, 차선이 좁아지는 지점 임에도 불구하고 3차로에서 2차로로 진입하려는 차량이 있는지 여부를 제대로 살피지 않는 채 만연히 빠른 속도로 진행한 A차량의 오른쪽 뒤 범퍼 부분을 B차량의 왼쪽 앞 범퍼 부분으로 충돌한 사고 : B과실 60%"
,직선 도로,열린 문 접촉 사고,후행 직진,선행 자동차(정차 중 문 열림),20,80,4,"기타 유형의 사고(주차장,회전교차로 등) > 문 열림 사고 > 후행 직진 대 문 열림 > 차52-1","◆도로교통법 제49조(모든 운전자의 준수사항 등) 
① 모든 차 또는 노면전차의 운전자는 다음 각 호의 사항을 지켜야 한다.
7. 운전자는 안전을 확인하지 아니하고 차 또는 노면전차의 문을 열거나 내려서는 아니 되며, 동승자가 교통의 위험을 일으키지 아니하도록 필요한 조치를 할 것
◆도로교통법 제38조(차의 신호) 
① 모든 차의 운전자는 좌회전·우회전·횡단·유턴·서행·정지 또는 후진을 하거나 같은 방향으로 진행하면서 진로를 바꾸려고 하는 경우와 회전교차로에 진입하거나 회전교차로에서 진출하는 경우에는 손이나 방향지시기 또는 등화로써 그 행위가 끝날 때까지 신호를 하여야 한다.
② 제1항의 신호를 하는 시기와 방법은 대통령령으로 정한다.","◆서울중앙지방법원 2016. 10. 20. 선고 2016나1839 판결 
이면도로 골목길에서 주차를 완료한 B차량의 운전자가 하차하기 위해 문을 개방하다가 때마침 B차량의 왼쪽을 진행하던 A차량과 접촉한 사고 : B과실 80%"
,직선 도로,역주행 사고(중앙선 침범),직진,중앙선 침범 직진,0,100,5,마주보는 방향 진행차량 상호 간의 사고 > 중앙선 침범 사고 > 직진 대 중앙선 침범 역주행 > 차31-1,"◆도로교통법 제13조(차마의 통행) 
① 차마의 운전자는 보도와 차도가 구분된 도로에서는 차도로 통행하여야 한다. 다만, 도로 외의 곳으로 출입할 때에는 보도를 횡단하여 통행할 수 있다.
③ 차마의 운전자는 도로(보도와 차도가 구분된 도로에서는 차도를 말한다)의 중앙(중앙선이 설치되어 있는 경우에는 그 중앙선을 말한다. 이하 같다) 우측 부분을 통행하여야 한다.
④ 차마의 운전자는 제3항에도 불구하고 다음 각 호의 어느 하나에 해당하는 경우에는 도로 의 중앙이나 좌측 부분을 통행할 수 있다.
1. 도로가 일방통행인 경우
②. 도로의 파손, 도로공사나 그 밖의 장애 등으로 도로의 우측 부분을 통행할 수 없는 경우
③. 도로 우측 부분의 폭이
⑥미터가 되지 아니하는 도로에서 다른 차를 앞지르려는 경우. 다만, 다음 각 목의 어느 하나에 해당하는 경우에는 그러하지 아니하다.
가. 도로의 좌측 부분을 확인할 수 없는 경우
나. 반대 방향의 교통을 방해할 우려가 있는 경우다. 안전표지 등으로 앞지르기를 금지하거나 제한하고 있는 경우
④. 도로 우측 부분의 폭이 차마의 통행에 충분하지 아니한 경우 5. 가파른 비탈길의 구부러진 곳에서 교통의 위험을 방지하기 위하여 시·도경찰청장이 필요하 다고 인정하여 구간 및 통행방법을 지정하고 있는 경우에 그 지정에 따라 통행하는 경우
◆도로교통법 제14조(차로의 설치 등) 
② 차마의 운전자는 차로가 설치되어 있는 도로에서는 이 법이나 이 법에 따른 명령에 특별한 규정이 있는 경우를 제외하고는 그 차로를 따라 통행하여야 한다. 다만, 시·도경찰청장이 통행방법을 따로 지정한 경우에는 그 방법으로 통행하여야 한다.","◆대법원 2001.2.9.선고 2000다67464 판결 
일반적으로 중앙선이 설치된 도로를 자기 차로를 따라 운행하는 자동차 운전자로서는 마주오는 자동차도 자기 차로를 지켜 운행하리라고 신뢰하는 것이 보통이므로, 상대방 자동차의 비정상적인 운행을 예견할 수 있는 특별한 사정이 없다면, 상대방 자동차가 중앙선을 침범해 들어올 경우까지 예상하여 미리 2차로나 도로 오른쪽 가장자리로 붙여 운전하여야 할 주의의무는 없고, 또한 운전자가 제한속도를 초과하여 운전하는 등 교통법규를 위반하였다고 하더라 도 그와 같이 과속운행 등을 하지 아니하였다면 상대방 자동차의 중앙선 침범을 발견하는 즉시 감속하거나 피행함으로써 충돌을 피할 수 있었다는 사정이 있었던 경우에 한하여 과속운행을 과실로 볼 수 있다.
◆대법원 1997.11.28.선고 97다31618 판결, 대법원 2001.3.9.선고 2000다70576 판결 
일반적으로 중앙선이 설치된 도로를 자기 차선을 따라 운행하는 자동차 운전자로서는 마주오는 자동차도 제 차선을 지켜 운행하리라고 신뢰하는 것이 보통이므로, 상대방 자동차가 도로의 중앙선을 침범하여 들어올 것까지 예상하여 특별한 조치를 강구하여야 할 주의의무는 없으나, 다만 마주오는 차가 이미 비정상적으로 중앙선을 침범하여 진행하여 오는 것을 미리 목격한 경우라면, 그 차가 그대로 비정상적으로 운행을 계속함으로써 진로를 방해할 것에 대비하 여 경음기나 전조등을 이용하여 경고 신호를 보내거나 감속하면서 도로 오른쪽단으로 피행하는 등으로 그 차와 자기 차와의 접촉 충돌에 의한 위험의 발생을 방지하기 위한 적절한 방어운전 조치를 취하여 이에 충분히 대처할 수 있는 상황이었음에도 불구하고 그러한 제반 조치를 게을리한 경우에 한하여 그에게 상대방 자동차와 자기 차의 충돌에 의한 사고의 발생에 대하여 과실이 있다고 인정할 수 있다.
◆서울고등법원 2011.5.27.선고 2010나112433 판결 (서울중앙지방법원 2008가 단250918 판결) 
주간에 편도1차로의 도로에서 B차량이 중앙선을 침범하여 진행한 과실로, 마침 맞은 편에서 진행하던 A차량의 앞부분을 충격하여 상해를 입힌 사고 : B과실 100%
◆대법원 2000.7.7. 선고 2000도2116 판결 
도로교통법 제12조 제3항에 의하여 차마는 차도의 중앙선으로부터 우측 부분을 통행하도록 의무 지워져 있으며, 차선이 설치된 도로상에 차량의 통행이 방향별로 명확하게 구분되게 하기 위하여 도로상에 황색실선으로 표시된 중앙선은 그 선을 경계로 서로 반대방향으로 운행하는 차선이 접하게 되는 것이어서 각 차선을 운행하는 운전자로서는 특단의 사정이 없는 한 반대 차선 내에 있는 차량이 그 경계선을 넘어 들어오지 않을 것으로 신뢰하여 운행하는 것이므로 부득이한 사유가 없음에도 고의로 경계인 그 중앙선을 넘어들어가 침범 당하는 차선의 차량운행자의 신뢰에 어긋나는 운행을 하였다면 그러한 침범운행의 동기가 무엇인가에 따라 책임의 유무가 달라질 수 없는 것이므로 좌회전 또는 유턴(U-turn)을 하려고 하였다 하더라도 중앙선 침범의 죄책을 면할 수 없다.
◆대법원 2007.5.10. 선고 2006다3295 판결 
야간에 편도2차로 도로에서 A이륜차가 중앙선을 침범하여 역주행하다가 직진하던 B차량과 충돌한 사고 : B과실 0%"
